{
  "$schema": "https://json-schema.org/draft/2020-12/schema",
  "$id": "https://contracts.opsclawd.dev/regime-engine/policy-insight/v1/policy-insight.schema.json",
  "$ref": "#/$defs/PolicyInsightRead",
  "$defs": {
    "canonicalTimestamp": {
      "type": "string",
      "pattern": "^\\d{4}-\\d{2}-\\d{2}T\\d{2}:\\d{2}:\\d{2}\\.\\d{3}Z$"
    },
    "hex64": {
      "type": "string",
      "pattern": "^[a-f0-9]{64}$"
    },
    "identifier": {
      "type": "string",
      "minLength": 1,
      "maxLength": 128
    },
    "positiveDecimalString": {
      "type": "string",
      "pattern": "^(0|[1-9]\\d*)(\\.\\d+)?$",
      "minLength": 1,
      "maxLength": 64
    },
    "schemaVersion": {
      "const": "policy-insight.v1"
    },
    "pair": {
      "const": "SOL/USDC"
    },
    "marketRegime": {
      "enum": ["UP", "DOWN", "CHOP"]
    },
    "fundamentalRegime": {
      "enum": ["BULLISH", "BEARISH", "NEUTRAL", "UNKNOWN"]
    },
    "posture": {
      "enum": ["AGGRESSIVE", "MODERATELY_AGGRESSIVE", "NEUTRAL", "DEFENSIVE", "PAUSED"]
    },
    "recommendedAction": {
      "enum": [
        "HOLD",
        "MONITOR_LOWER_BOUND",
        "MONITOR_UPPER_BOUND",
        "EXIT_TO_USDC",
        "EXIT_TO_SOL",
        "STAND_DOWN"
      ]
    },
    "riskLevel": {
      "enum": ["NORMAL", "ELEVATED", "CRITICAL"]
    },
    "rangeBias": {
      "enum": ["TIGHT", "MEDIUM", "WIDE", "PASSIVE"]
    },
    "rebalanceSensitivity": {
      "enum": ["LOW", "NORMAL", "HIGH", "PAUSED"]
    },
    "maxCapitalDeploymentBps": {
      "type": "integer",
      "minimum": 0,
      "maximum": 10000
    },
    "confidenceBps": {
      "type": "integer",
      "minimum": 0,
      "maximum": 10000
    },
    "dataQuality": {
      "enum": ["COMPLETE", "PARTIAL", "STALE"]
    },
    "selectionStatus": {
      "enum": ["FULL", "PARTIAL", "DEGRADED"]
    },
    "reasonCode": {
      "enum": [
        "ADVISORY_ONLY",
        "DATA_HARD_STALE",
        "DATA_INSUFFICIENT_SAMPLES",
        "CLMM_BREACH_LOWER",
        "CLMM_BREACH_UPPER",
        "CHURN_STAND_DOWN_ACTIVE",
        "CHURN_COOLDOWN_ACTIVE",
        "MARKET_REGIME_UP",
        "MARKET_REGIME_DOWN",
        "MARKET_REGIME_CHOP",
        "FEATURE_THRESHOLD_BREACHED",
        "CONTEXTUAL_EVIDENCE_VOTE",
        "RESEARCH_BRIEF_ANALYSIS",
        "NO_ELIGIBLE_PRICE_LEVELS"
      ]
    },
    "warningCode": {
      "enum": [
        "MARKET_DATA_HARD_STALE",
        "EVIDENCE_STALE_INPUT",
        "EVIDENCE_MISSING_FAMILY",
        "EVIDENCE_REJECTED_FAMILY",
        "EVIDENCE_CONFLICTED_FAMILY",
        "EVIDENCE_NO_SELECTED_RESEARCH",
        "NO_ELIGIBLE_PRICE_LEVELS"
      ]
    },
    "freshnessStatus": {
      "enum": ["FRESH", "STALE"]
    },
    "positionScope": {
      "type": "object",
      "additionalProperties": false,
      "required": ["network", "walletAddress", "whirlpoolAddress", "positionId"],
      "properties": {
        "network": {
          "const": "solana-mainnet"
        },
        "walletAddress": {
          "$ref": "#/$defs/identifier"
        },
        "whirlpoolAddress": {
          "$ref": "#/$defs/identifier"
        },
        "positionId": {
          "$ref": "#/$defs/identifier"
        }
      }
    },
    "clmmPolicy": {
      "type": "object",
      "additionalProperties": false,
      "required": ["rangeBias", "rebalanceSensitivity", "maxCapitalDeploymentBps"],
      "properties": {
        "rangeBias": {
          "$ref": "#/$defs/rangeBias"
        },
        "rebalanceSensitivity": {
          "$ref": "#/$defs/rebalanceSensitivity"
        },
        "maxCapitalDeploymentBps": {
          "$ref": "#/$defs/maxCapitalDeploymentBps"
        }
      }
    },
    "levels": {
      "type": "object",
      "additionalProperties": false,
      "required": ["supportsUsdcPerSol", "resistancesUsdcPerSol"],
      "properties": {
        "supportsUsdcPerSol": {
          "type": "array",
          "items": {
            "$ref": "#/$defs/positiveDecimalString"
          },
          "maxItems": 16
        },
        "resistancesUsdcPerSol": {
          "type": "array",
          "items": {
            "$ref": "#/$defs/positiveDecimalString"
          },
          "maxItems": 16
        }
      }
    },
    "bundleRef": {
      "type": "object",
      "additionalProperties": false,
      "required": ["bundleHash", "publisher", "sourceId", "runId"],
      "properties": {
        "bundleHash": {
          "$ref": "#/$defs/hex64"
        },
        "publisher": {
          "$ref": "#/$defs/identifier"
        },
        "sourceId": {
          "$ref": "#/$defs/identifier"
        },
        "runId": {
          "$ref": "#/$defs/identifier"
        }
      }
    },
    "sourceRef": {
      "type": "object",
      "additionalProperties": false,
      "required": ["referenceId", "sourceType", "locator", "observedAt"],
      "properties": {
        "referenceId": {
          "$ref": "#/$defs/identifier"
        },
        "sourceType": {
          "enum": ["api", "database", "chain", "document", "internal_bundle"]
        },
        "locator": {
          "type": "string",
          "minLength": 1,
          "maxLength": 2048
        },
        "observedAt": {
          "$ref": "#/$defs/canonicalTimestamp"
        }
      }
    },
    "evidence": {
      "type": "object",
      "additionalProperties": false,
      "required": [
        "selectionStatus",
        "selectionPolicyVersion",
        "selectedBundleRefs",
        "selectedSourceRefs"
      ],
      "properties": {
        "selectionStatus": {
          "$ref": "#/$defs/selectionStatus"
        },
        "selectionPolicyVersion": {
          "$ref": "#/$defs/identifier"
        },
        "selectedBundleRefs": {
          "type": "array",
          "items": {
            "$ref": "#/$defs/bundleRef"
          }
        },
        "selectedSourceRefs": {
          "type": "array",
          "items": {
            "$ref": "#/$defs/sourceRef"
          }
        }
      }
    },
    "warning": {
      "type": "object",
      "additionalProperties": false,
      "required": ["code", "message"],
      "properties": {
        "code": {
          "$ref": "#/$defs/warningCode"
        },
        "message": {
          "type": "string",
          "minLength": 1,
          "maxLength": 2048
        }
      }
    },
    "freshness": {
      "type": "object",
      "additionalProperties": false,
      "required": ["status", "evaluatedAt", "ageSeconds"],
      "description": "Read-time freshness projection. ageSeconds is computed as: floor((evaluatedAtUnixMs - asOfUnixMs) / 1000). Status FRESH indicates ageSeconds < staleness threshold; STALE otherwise. This structure is explicitly excluded from content hashing since ageSeconds varies on every read.",
      "properties": {
        "status": {
          "$ref": "#/$defs/freshnessStatus",
          "description": "FRESH if ageSeconds is below staleness threshold, STALE otherwise."
        },
        "evaluatedAt": {
          "$ref": "#/$defs/canonicalTimestamp",
          "description": "Timestamp when freshness was evaluated. Typically the current server time."
        },
        "ageSeconds": {
          "type": "integer",
          "minimum": 0,
          "description": "Age in seconds since asOf timestamp: floor((evaluatedAt - asOf) / 1000). Always >= 0."
        }
      }
    },
    "PolicyInsightContent": {
      "type": "object",
      "additionalProperties": false,
      "required": [
        "schemaVersion",
        "insightId",
        "rulesetVersion",
        "pair",
        "position",
        "generatedAt",
        "asOf",
        "expiresAt",
        "marketRegime",
        "fundamentalRegime",
        "posture",
        "recommendedAction",
        "riskLevel",
        "clmmPolicy",
        "levels",
        "evidence",
        "confidenceBps",
        "dataQuality",
        "reasonCodes",
        "reasoning",
        "warnings"
      ],
      "description": "Immutable policy insight content. This is the stable, hashable portion that excludes read-time freshness. The content identity is the SHA-256 hash of its canonical JSON representation.",
      "properties": {
        "schemaVersion": {
          "$ref": "#/$defs/schemaVersion",
          "description": "Contract version identifier. Must be 'policy-insight.v1' for this schema."
        },
        "insightId": {
          "$ref": "#/$defs/hex64",
          "description": "Unique identifier for this insight instance. Generated by the synthesis process."
        },
        "rulesetVersion": {
          "$ref": "#/$defs/identifier",
          "description": "Version identifier of the ruleset that produced this insight."
        },
        "pair": {
          "$ref": "#/$defs/pair",
          "description": "Trading pair this insight applies to. Currently only SOL/USDC is supported."
        },
        "position": {
          "anyOf": [{ "$ref": "#/$defs/positionScope" }, { "type": "null" }],
          "description": "Position scope when this insight applies to a specific liquidity position. Null when insight is pair-level only. EXIT_TO_USDC and EXIT_TO_SOL actions require a non-null position; HOLD and STAND_DOWN typically have null position."
        },
        "generatedAt": {
          "$ref": "#/$defs/canonicalTimestamp",
          "description": "Timestamp when this insight was generated by the ruleset."
        },
        "asOf": {
          "$ref": "#/$defs/canonicalTimestamp",
          "description": "Market data instant this insight was evaluated against. Must be >= generatedAt."
        },
        "expiresAt": {
          "$ref": "#/$defs/canonicalTimestamp",
          "description": "Expiration timestamp for this insight. Must be > generatedAt. Consumer should treat insight as stale after this time."
        },
        "marketRegime": {
          "$ref": "#/$defs/marketRegime",
          "description": "Market regime classification at asOf timestamp. UP indicates bullish trends, DOWN bearish, CHOP sideways/ranging."
        },
        "fundamentalRegime": {
          "$ref": "#/$defs/fundamentalRegime",
          "description": "Fundamental market outlook derived from on-chain and off-chain signals."
        },
        "posture": {
          "$ref": "#/$defs/posture",
          "description": "Risk posture recommendation. AGGRESSIVE allows wider ranges and higher capital deployment; DEFENSIVE restricts to narrower ranges and lower deployment; PAUSED indicates no new positions."
        },
        "recommendedAction": {
          "$ref": "#/$defs/recommendedAction",
          "description": "Advisory action for the position. HOLD maintains current state; EXIT_TO_USDC/EXIT_TO_SOL close position to stable or SOL; STAND_DOWN halts all position management; MONITOR_* indicate watching specific boundaries."
        },
        "riskLevel": {
          "$ref": "#/$defs/riskLevel",
          "description": "Current risk assessment for the position. CRITICAL indicates immediate action may be required."
        },
        "clmmPolicy": {
          "$ref": "#/$defs/clmmPolicy",
          "description": "Concentrated liquidity market making policy parameters for range and rebalance behavior."
        },
        "levels": {
          "$ref": "#/$defs/levels",
          "description": "Support and resistance price levels in units of USDC per SOL. These are canonical decimal strings for exact precision."
        },
        "evidence": {
          "$ref": "#/$defs/evidence",
          "description": "Evidence trail documenting which data sources and bundles contributed to this insight."
        },
        "confidenceBps": {
          "$ref": "#/$defs/confidenceBps",
          "description": "Confidence in basis points (0-10000) that the recommended action is correct given the evidence."
        },
        "dataQuality": {
          "$ref": "#/$defs/dataQuality",
          "description": "Assessment of input data completeness. STALE indicates some evidence may be outdated."
        },
        "reasonCodes": {
          "type": "array",
          "items": {
            "$ref": "#/$defs/reasonCode"
          },
          "minItems": 1,
          "maxItems": 16,
          "description": "Ordered reason codes explaining why this insight was generated, sorted by decreasing priority. First code is primary driver. Ordering matters for semantic validation."
        },
        "reasoning": {
          "type": "string",
          "minLength": 1,
          "maxLength": 2048,
          "description": "Human-readable explanation of the insight reasoning."
        },
        "warnings": {
          "type": "array",
          "items": {
            "$ref": "#/$defs/warning"
          },
          "maxItems": 16,
          "description": "Non-fatal warnings about data quality, conflicting evidence, or other advisory conditions."
        }
      }
    },
    "PolicyInsightFreshness": {
      "$ref": "#/$defs/freshness"
    },
    "PolicyInsightRead": {
      "type": "object",
      "additionalProperties": false,
      "required": [
        "schemaVersion",
        "insightId",
        "rulesetVersion",
        "pair",
        "position",
        "generatedAt",
        "asOf",
        "expiresAt",
        "marketRegime",
        "fundamentalRegime",
        "posture",
        "recommendedAction",
        "riskLevel",
        "clmmPolicy",
        "levels",
        "evidence",
        "confidenceBps",
        "dataQuality",
        "reasonCodes",
        "reasoning",
        "warnings",
        "freshness"
      ],
      "description": "Complete policy insight read projection with content and freshness. This is the immutable content plus read-time freshness evaluation. Content portion is hashable; freshness is not included in hash.",
      "properties": {
        "schemaVersion": {
          "$ref": "#/$defs/schemaVersion"
        },
        "insightId": {
          "$ref": "#/$defs/hex64"
        },
        "rulesetVersion": {
          "$ref": "#/$defs/identifier"
        },
        "pair": {
          "$ref": "#/$defs/pair"
        },
        "position": {
          "anyOf": [{ "$ref": "#/$defs/positionScope" }, { "type": "null" }]
        },
        "generatedAt": {
          "$ref": "#/$defs/canonicalTimestamp"
        },
        "asOf": {
          "$ref": "#/$defs/canonicalTimestamp"
        },
        "expiresAt": {
          "$ref": "#/$defs/canonicalTimestamp"
        },
        "marketRegime": {
          "$ref": "#/$defs/marketRegime"
        },
        "fundamentalRegime": {
          "$ref": "#/$defs/fundamentalRegime"
        },
        "posture": {
          "$ref": "#/$defs/posture"
        },
        "recommendedAction": {
          "$ref": "#/$defs/recommendedAction"
        },
        "riskLevel": {
          "$ref": "#/$defs/riskLevel"
        },
        "clmmPolicy": {
          "$ref": "#/$defs/clmmPolicy"
        },
        "levels": {
          "$ref": "#/$defs/levels"
        },
        "evidence": {
          "$ref": "#/$defs/evidence"
        },
        "confidenceBps": {
          "$ref": "#/$defs/confidenceBps"
        },
        "dataQuality": {
          "$ref": "#/$defs/dataQuality"
        },
        "reasonCodes": {
          "type": "array",
          "items": {
            "$ref": "#/$defs/reasonCode"
          },
          "minItems": 1,
          "maxItems": 16
        },
        "reasoning": {
          "type": "string",
          "minLength": 1,
          "maxLength": 2048
        },
        "warnings": {
          "type": "array",
          "items": {
            "$ref": "#/$defs/warning"
          },
          "maxItems": 16
        },
        "freshness": {
          "$ref": "#/$defs/freshness"
        }
      }
    },
    "PolicyInsightHistoryResponse": {
      "type": "object",
      "additionalProperties": false,
      "required": ["schemaVersion", "pair", "queriedAt", "limit", "items", "nextCursor"],
      "description": "Paginated history response containing PolicyInsightRead items in reverse chronological order (newest first). Use nextCursor from last item to fetch next page.",
      "properties": {
        "schemaVersion": {
          "$ref": "#/$defs/schemaVersion"
        },
        "pair": {
          "$ref": "#/$defs/pair"
        },
        "queriedAt": {
          "$ref": "#/$defs/canonicalTimestamp",
          "description": "Server timestamp when this history query was executed."
        },
        "limit": {
          "type": "integer",
          "minimum": 1,
          "maximum": 100,
          "description": "Maximum number of items requested. Actual items may be fewer if fewer exist."
        },
        "items": {
          "type": "array",
          "items": {
            "$ref": "#/$defs/PolicyInsightRead"
          },
          "description": "Array of PolicyInsightRead items, ordered newest-first by generatedAt."
        },
        "nextCursor": {
          "anyOf": [{ "type": "string" }, { "type": "null" }],
          "description": "Opaque cursor for fetching next page. Null when no more items exist."
        }
      }
    }
  }
}
