{
  "schemaVersion": "policy-insight.v1",
  "insightId": "a1b2c3d4e5f6a1b2c3d4e5f6a1b2c3d4e5f6a1b2c3d4e5f6a1b2c3d4e5f6a1",
  "rulesetVersion": "sol-usdc-policy.v1.2026-07",
  "pair": "SOL/USDC",
  "position": null,
  "generatedAt": "2026-07-19T12:00:00.000Z",
  "asOf": "2026-07-19T11:59:00.000Z",
  "expiresAt": "2026-07-19T13:00:00.000Z",
  "marketRegime": "UP",
  "fundamentalRegime": "BULLISH",
  "posture": "AGGRESSIVE",
  "recommendedAction": "HOLD",
  "riskLevel": "NORMAL",
  "clmmPolicy": {
    "rangeBias": "MEDIUM",
    "rebalanceSensitivity": "NORMAL",
    "maxCapitalDeploymentBps": 7500
  },
  "levels": {
    "supportsUsdcPerSol": [],
    "resistancesUsdcPerSol": []
  },
  "evidence": {
    "selectionStatus": "FULL",
    "selectionPolicyVersion": "selector.v1.2026-07",
    "selectedBundleRefs": [],
    "selectedSourceRefs": []
  },
  "confidenceBps": 7500,
  "dataQuality": "COMPLETE",
  "reasonCodes": ["MARKET_REGIME_UP", "ADVISORY_ONLY"],
  "reasoning": "Market regime is UP with bullish fundamental signals. No position-specific triggers present.",
  "warnings": [],
  "freshness": {
    "status": "FRESH",
    "evaluatedAt": "2026-07-19T12:00:00.000Z",
    "ageSeconds": 60
  }
}
